{
 "$schema": "http://json-schema.org/draft-07/schema#",
 "$id": "market.schema.json",
 "title": "finsights.explore market data (public/data/market.json)",
 "description": "Mirrors MarketData in src/types.ts. The data job validates against this file before it writes anything.",
 "type": "object",
 "additionalProperties": false,
 "required": [
  "schema",
  "asOf",
  "source",
  "period",
  "industries",
  "stocks"
 ],
 "properties": {
  "schema": {
   "const": 2
  },
  "asOf": {
   "type": "string",
   "pattern": "^\\d{4}-\\d{2}-\\d{2}T\\d{2}:\\d{2}:\\d{2}(\\.\\d+)?(Z|[+-]\\d{2}:\\d{2})$",
   "description": "ISO 8601 with UTC offset; the time of the latest update of either market"
  },
  "asOfBy": {
   "type": "object",
   "additionalProperties": false,
   "description": "Data time per market (the job fetches one market per scheduled run). A market without an entry uses asOf.",
   "properties": {
    "BIST": {
     "type": "string",
     "pattern": "^\\d{4}-\\d{2}-\\d{2}T\\d{2}:\\d{2}:\\d{2}(\\.\\d+)?(Z|[+-]\\d{2}:\\d{2})$"
    },
    "US": {
     "type": "string",
     "pattern": "^\\d{4}-\\d{2}-\\d{2}T\\d{2}:\\d{2}:\\d{2}(\\.\\d+)?(Z|[+-]\\d{2}:\\d{2})$"
    }
   }
  },
  "source": {
   "type": "string",
   "minLength": 1,
   "description": "Short display string for the data bar"
  },
  "period": {
   "type": "object",
   "additionalProperties": false,
   "description": "Balance-sheet period per market, YEAR/MONTH of the latest reported quarter, e.g. 2026/6",
   "properties": {
    "BIST": {
     "$ref": "#/definitions/period"
    },
    "US": {
     "$ref": "#/definitions/period"
    }
   }
  },
  "industries": {
   "type": "object",
   "propertyNames": {
    "pattern": "^[a-z][a-z0-9_]*$"
   },
   "additionalProperties": {
    "$ref": "#/definitions/industry"
   }
  },
  "stocks": {
   "type": "array",
   "items": {
    "$ref": "#/definitions/stock"
   }
  }
 },
 "definitions": {
  "period": {
   "type": "string",
   "pattern": "^\\d{4}/(1[0-2]|[1-9])$"
  },
  "num": {
   "type": [
    "number",
    "null"
   ]
  },
  "positive": {
   "type": [
    "number",
    "null"
   ],
   "exclusiveMinimum": 0
  },
  "industry": {
   "type": "object",
   "additionalProperties": false,
   "required": [
    "nameTr",
    "nameEn",
    "cyclical"
   ],
   "properties": {
    "nameTr": {
     "type": "string",
     "minLength": 1
    },
    "nameEn": {
     "type": "string",
     "minLength": 1
    },
    "cyclical": {
     "type": "boolean"
    }
   }
  },
  "stock": {
   "type": "object",
   "additionalProperties": false,
   "required": [
    "symbol",
    "name",
    "market",
    "currency",
    "industry",
    "price",
    "pe",
    "pb",
    "evEbitda",
    "peg",
    "netDebtEbitda",
    "marketCap",
    "ebitdaGrowth",
    "netIncomeGrowth",
    "targetPrice",
    "sma20",
    "sma50",
    "sma200"
   ],
   "properties": {
    "symbol": {
     "type": "string",
     "pattern": "^[A-Z0-9][A-Z0-9.\\-]{0,11}$"
    },
    "name": {
     "type": "string",
     "minLength": 1
    },
    "market": {
     "enum": [
      "BIST",
      "US"
     ]
    },
    "currency": {
     "enum": [
      "TRY",
      "USD"
     ]
    },
    "industry": {
     "type": "string"
    },
    "bank": {
     "type": "boolean"
    },
    "cyc": {
     "type": "boolean"
    },
    "price": {
     "$ref": "#/definitions/positive"
    },
    "pe": {
     "$ref": "#/definitions/positive"
    },
    "loss": {
     "type": "boolean",
     "description": "Loss over the trailing twelve months (EPS zero or negative). Absent: no loss, or unknown."
    },
    "pb": {
     "$ref": "#/definitions/positive"
    },
    "evEbitda": {
     "$ref": "#/definitions/positive"
    },
    "peg": {
     "$ref": "#/definitions/num"
    },
    "netDebtEbitda": {
     "$ref": "#/definitions/num"
    },
    "marketCap": {
     "type": [
      "number",
      "null"
     ],
     "minimum": 0
    },
    "ebitdaGrowth": {
     "$ref": "#/definitions/num"
    },
    "netIncomeGrowth": {
     "$ref": "#/definitions/num"
    },
    "ebitdaGrowthNote": {
     "type": "string"
    },
    "netIncomeGrowthNote": {
     "type": "string"
    },
    "targetPrice": {
     "$ref": "#/definitions/positive"
    },
    "sma20": {
     "$ref": "#/definitions/positive"
    },
    "sma50": {
     "$ref": "#/definitions/positive"
    },
    "sma200": {
     "$ref": "#/definitions/positive"
    },
    "usd": {
     "type": "string"
    },
    "note": {
     "type": "string"
    },
    "noteAsOf": {
     "type": "string",
     "pattern": "^\\d{4}-\\d{2}-\\d{2}$"
    },
    "npl": {
     "$ref": "#/definitions/num"
    },
    "car": {
     "$ref": "#/definitions/num"
    },
    "nim": {
     "$ref": "#/definitions/num"
    }
   },
   "allOf": [
    {
     "if": {
      "properties": {
       "market": {
        "const": "BIST"
       }
      }
     },
     "then": {
      "properties": {
       "currency": {
        "const": "TRY"
       }
      }
     }
    },
    {
     "if": {
      "properties": {
       "market": {
        "const": "US"
       }
      }
     },
     "then": {
      "properties": {
       "currency": {
        "const": "USD"
       }
      }
     }
    }
   ]
  }
 }
}
