{
 "schema": 2,
 "asOf": "2026-10-02T15:00:00+03:00",
 "asOfBy": {
  "BIST": "2026-10-02T15:00:00+03:00"
 },
 "source": "Fintables (2 Ekim 2026 anlık görüntüsü)",
 "period": {
  "BIST": "2026/6"
 },
 "industries": {
  "food_beverage": {
   "nameTr": "Gıda-içecek",
   "nameEn": "Food & beverage",
   "cyclical": false
  },
  "defense": {
   "nameTr": "Savunma",
   "nameEn": "Defense",
   "cyclical": false
  },
  "electrical_equipment": {
   "nameTr": "Elektrik ekipmanı",
   "nameEn": "Electrical equipment",
   "cyclical": false
  },
  "retail": {
   "nameTr": "Perakende",
   "nameEn": "Retail",
   "cyclical": false
  },
  "real_estate": {
   "nameTr": "Gayrimenkul",
   "nameEn": "Real estate",
   "cyclical": false
  },
  "construction": {
   "nameTr": "İnşaat ve mühendislik",
   "nameEn": "Construction & engineering",
   "cyclical": false
  },
  "steel": {
   "nameTr": "Demir-çelik",
   "nameEn": "Steel",
   "cyclical": true
  },
  "automotive": {
   "nameTr": "Otomotiv",
   "nameEn": "Automotive",
   "cyclical": false
  },
  "fertilizers": {
   "nameTr": "Gübre-kimya",
   "nameEn": "Fertilizers & chemicals",
   "cyclical": false
  },
  "holding": {
   "nameTr": "Holding",
   "nameEn": "Holding company",
   "cyclical": false
  },
  "petrochemicals": {
   "nameTr": "Petrokimya",
   "nameEn": "Petrochemicals",
   "cyclical": true
  },
  "airlines": {
   "nameTr": "Havayolu",
   "nameEn": "Airlines",
   "cyclical": true
  },
  "chemicals_textile": {
   "nameTr": "Kimya-tekstil",
   "nameEn": "Chemicals & textiles",
   "cyclical": true
  },
  "glass": {
   "nameTr": "Cam-kimya",
   "nameEn": "Glass & chemicals",
   "cyclical": false
  },
  "airports": {
   "nameTr": "Havalimanı",
   "nameEn": "Airport operator",
   "cyclical": false
  },
  "telecom": {
   "nameTr": "Telekom",
   "nameEn": "Telecom",
   "cyclical": false
  },
  "gold_mining": {
   "nameTr": "Altın madenciliği",
   "nameEn": "Gold mining",
   "cyclical": true
  },
  "metal_mining": {
   "nameTr": "Metal madenciliği",
   "nameEn": "Metals & mining",
   "cyclical": true
  },
  "refining": {
   "nameTr": "Rafineri",
   "nameEn": "Oil refining",
   "cyclical": true
  },
  "semiconductors": {
   "nameTr": "Yarı iletken",
   "nameEn": "Semiconductors",
   "cyclical": true
  },
  "software": {
   "nameTr": "Yazılım",
   "nameEn": "Software",
   "cyclical": false
  },
  "internet": {
   "nameTr": "İnternet ve e-ticaret",
   "nameEn": "Internet & e-commerce",
   "cyclical": false
  },
  "consumer_electronics": {
   "nameTr": "Tüketici elektroniği ve donanım",
   "nameEn": "Consumer electronics & hardware",
   "cyclical": false
  },
  "pharmaceuticals": {
   "nameTr": "İlaç",
   "nameEn": "Pharmaceuticals",
   "cyclical": false
  },
  "banks": {
   "nameTr": "Banka",
   "nameEn": "Banks",
   "cyclical": false
  }
 },
 "stocks": [
  {
   "symbol": "AEFES",
   "name": "Anadolu Efes",
   "market": "BIST",
   "currency": "TRY",
   "industry": "food_beverage",
   "price": 17.81,
   "pe": 10.51,
   "pb": 0.84,
   "evEbitda": 3.3,
   "peg": -0.32,
   "netDebtEbitda": 1.26,
   "marketCap": 105,
   "ebitdaGrowth": 26,
   "netIncomeGrowth": -7,
   "targetPrice": 27.56,
   "sma20": null,
   "sma50": null,
   "sma200": null,
   "note": "FAVÖK %26 artarken net kâr %7 gerilemiş; fark faaliyet dışı kalemlerden geliyor.",
   "noteAsOf": "2026-10-02"
  },
  {
   "symbol": "ASELS",
   "name": "Aselsan",
   "market": "BIST",
   "currency": "TRY",
   "industry": "defense",
   "price": 372.75,
   "pe": 40.66,
   "pb": 5.47,
   "evEbitda": 27.96,
   "peg": 0.64,
   "netDebtEbitda": 0.55,
   "marketCap": 1677,
   "ebitdaGrowth": 31,
   "netIncomeGrowth": 71,
   "targetPrice": 466.72,
   "sma20": null,
   "sma50": null,
   "sma200": null,
   "note": "Güçlü büyüme beklentisi fiyata yansımış. PEG makul ama F/K endeksin çok üzerinde.",
   "noteAsOf": "2026-10-02"
  },
  {
   "symbol": "ASTOR",
   "name": "Astor Enerji",
   "market": "BIST",
   "currency": "TRY",
   "industry": "electrical_equipment",
   "price": 228.1,
   "pe": 20.23,
   "pb": 5.18,
   "evEbitda": 15.51,
   "peg": 0.49,
   "netDebtEbitda": -0.67,
   "marketCap": 227,
   "ebitdaGrowth": 16,
   "netIncomeGrowth": 88,
   "targetPrice": 374.88,
   "sma20": null,
   "sma50": null,
   "sma200": null,
   "note": "Net kâr artışı FAVÖK artışının çok üzerinde; net parasal kaybın azalması kârı yukarı itmiş.",
   "noteAsOf": "2026-10-02"
  },
  {
   "symbol": "BIMAS",
   "name": "BİM",
   "market": "BIST",
   "currency": "TRY",
   "industry": "retail",
   "price": 407.5,
   "pe": 16.78,
   "pb": 2.46,
   "evEbitda": 9.47,
   "peg": 0.38,
   "netDebtEbitda": 0.58,
   "marketCap": 496,
   "ebitdaGrowth": 23,
   "netIncomeGrowth": 103,
   "targetPrice": 499.87,
   "sma20": null,
   "sma50": null,
   "sma200": null,
   "note": "Faaliyetler büyüyor; net kâr artışının bir kısmı net parasal pozisyon kazancından (+%32).",
   "noteAsOf": "2026-10-02"
  },
  {
   "symbol": "EKGYO",
   "name": "Emlak Konut GYO",
   "market": "BIST",
   "currency": "TRY",
   "industry": "real_estate",
   "price": 19.03,
   "pe": null,
   "pb": 0.47,
   "evEbitda": 5.95,
   "peg": null,
   "netDebtEbitda": 2.49,
   "marketCap": 72,
   "ebitdaGrowth": -30,
   "netIncomeGrowth": -81,
   "loss": true,
   "targetPrice": 32.54,
   "sma20": null,
   "sma50": null,
   "sma200": null,
   "note": "Son 12 ayda zarar. GYO'larda PD/DD ve proje stoğu öne çıkar.",
   "noteAsOf": "2026-10-02"
  },
  {
   "symbol": "ENKAI",
   "name": "Enka İnşaat",
   "market": "BIST",
   "currency": "TRY",
   "industry": "construction",
   "price": 82.65,
   "pe": 12.88,
   "pb": 1.22,
   "evEbitda": 9.84,
   "peg": 0.38,
   "netDebtEbitda": -5.13,
   "marketCap": 503,
   "ebitdaGrowth": -2,
   "netIncomeGrowth": 19,
   "targetPrice": 121.1,
   "sma20": null,
   "sma50": null,
   "sma200": null,
   "usd": "USD",
   "note": "FAVÖK gerilerken net kâr artmış; fark faaliyet dışı gelirlerden. Güçlü net nakit pozisyonu var.",
   "noteAsOf": "2026-10-02"
  },
  {
   "symbol": "EREGL",
   "name": "Ereğli Demir Çelik",
   "market": "BIST",
   "currency": "TRY",
   "industry": "steel",
   "price": 36.62,
   "pe": 33.28,
   "pb": 0.81,
   "evEbitda": 12.04,
   "peg": 0.7,
   "netDebtEbitda": 1.61,
   "marketCap": 257,
   "ebitdaGrowth": 50,
   "netIncomeGrowth": 415,
   "targetPrice": 46.79,
   "sma20": null,
   "sma50": null,
   "sma200": null,
   "usd": "USD",
   "note": "Kâr düşük bir bazdan toparlanıyor; çelik fiyatlarına bağlı döngüsel iş.",
   "noteAsOf": "2026-10-02"
  },
  {
   "symbol": "FROTO",
   "name": "Ford Otosan",
   "market": "BIST",
   "currency": "TRY",
   "industry": "automotive",
   "price": 73.8,
   "pe": 7.78,
   "pb": 1.44,
   "evEbitda": 7.29,
   "peg": -0.24,
   "netDebtEbitda": 2.2,
   "marketCap": 258,
   "ebitdaGrowth": -34,
   "netIncomeGrowth": -40,
   "targetPrice": 139.88,
   "sma20": null,
   "sma50": null,
   "sma200": null,
   "note": "Satış, FAVÖK ve net kâr birlikte gerilemiş. Düşük F/K bu yüzden ucuzluk anlamına gelmeyebilir.",
   "noteAsOf": "2026-10-02"
  },
  {
   "symbol": "GUBRF",
   "name": "Gübre Fabrikaları",
   "market": "BIST",
   "currency": "TRY",
   "industry": "fertilizers",
   "price": 420.5,
   "pe": 17.63,
   "pb": 3.56,
   "evEbitda": 9.25,
   "peg": 0.57,
   "netDebtEbitda": -0.36,
   "marketCap": 140,
   "ebitdaGrowth": 23,
   "netIncomeGrowth": 58,
   "targetPrice": null,
   "sma20": null,
   "sma50": null,
   "sma200": null,
   "note": "Satış, FAVÖK ve esas faaliyet kârı aynı hızda (%22-23) büyüyor; net nakit pozisyonunda. Analist kapsamı yok.",
   "noteAsOf": "2026-10-02"
  },
  {
   "symbol": "KCHOL",
   "name": "Koç Holding",
   "market": "BIST",
   "currency": "TRY",
   "industry": "holding",
   "price": 212.5,
   "pe": 14.06,
   "pb": 0.67,
   "evEbitda": 5.48,
   "peg": null,
   "netDebtEbitda": 3.63,
   "marketCap": 534,
   "ebitdaGrowth": 32,
   "netIncomeGrowth": 147,
   "targetPrice": 316.4,
   "sma20": null,
   "sma50": null,
   "sma200": null,
   "note": "Holding: değeri iştiraklerin toplamıdır ve net aktif değer iskontosuyla değerlendirilir. Konsolide borç, finans iştiraklerini de içerdiği için yüksek görünür.",
   "noteAsOf": "2026-10-02"
  },
  {
   "symbol": "KRDMD",
   "name": "Kardemir",
   "market": "BIST",
   "currency": "TRY",
   "industry": "steel",
   "price": 43.42,
   "pe": 11.31,
   "pb": 0.46,
   "evEbitda": 5.26,
   "peg": null,
   "netDebtEbitda": 0.03,
   "marketCap": 50,
   "ebitdaGrowth": 51,
   "netIncomeGrowth": null,
   "netIncomeGrowthNote": "zarardan kâra",
   "targetPrice": 51.05,
   "sma20": null,
   "sma50": null,
   "sma200": null,
   "note": "Geçen yıl aynı dönemde zarar, bu yıl kâr; büyüme oranı anlamlı hesaplanamaz.",
   "noteAsOf": "2026-10-02"
  },
  {
   "symbol": "MGROS",
   "name": "Migros",
   "market": "BIST",
   "currency": "TRY",
   "industry": "retail",
   "price": 500,
   "pe": 13.16,
   "pb": 0.97,
   "evEbitda": 3.09,
   "peg": -0.91,
   "netDebtEbitda": 0.21,
   "marketCap": 91,
   "ebitdaGrowth": -7,
   "netIncomeGrowth": -42,
   "targetPrice": 906.2,
   "sma20": null,
   "sma50": null,
   "sma200": null,
   "note": "Esas faaliyet zararda; kâr büyük ölçüde net parasal pozisyon kazancından.",
   "noteAsOf": "2026-10-02"
  },
  {
   "symbol": "PETKM",
   "name": "Petkim",
   "market": "BIST",
   "currency": "TRY",
   "industry": "petrochemicals",
   "price": 19.38,
   "pe": null,
   "pb": 0.65,
   "evEbitda": 64.61,
   "peg": null,
   "netDebtEbitda": 32.41,
   "marketCap": 49,
   "ebitdaGrowth": null,
   "netIncomeGrowth": null,
   "ebitdaGrowthNote": "eksiden artıya",
   "netIncomeGrowthNote": "zarardan kâra",
   "loss": true,
   "targetPrice": 20.53,
   "sma20": null,
   "sma50": null,
   "sma200": null,
   "note": "Son 12 ayda zarar. FAVÖK çok düşük olduğu için borç oranı aşırı yüksek görünüyor.",
   "noteAsOf": "2026-10-02"
  },
  {
   "symbol": "PGSUS",
   "name": "Pegasus",
   "market": "BIST",
   "currency": "TRY",
   "industry": "airlines",
   "price": 141.5,
   "pe": null,